{
  "house_id": "43132761",
  "analyzed_at": "2025-11-08T22:33:01.633956+00:00",
  "rules_version": "v2.0.0",
  "overall_score": 6.73,
  "category_scores": {
    "location": {
      "score": 6.5,
      "reasoning": "Park De Horn ligt in Dirkshorn (Noord-Holland), gebied met redelijke maar geen toplocatie toeristische aantrekkelijkheid. Positief: dorpszwembad op 5 min lopen, speelpark De Holle Bolle Boom op 5 min fietsen, dierentuin Van Blanckendaell (10 min rijden), stad Schagen met horeca/winkels (10 min). Strand van Callantsoog op ~10 min rijden. Negatief: geen A-locatie zoals Texel, Scheveningen of Zandvoort. Dit is B-locatie met vooral Nederlandse gezinnen als doelgroep. Bereikbaarheid: N242 op 2 km, maar geen snelweg direct nabij. Treinstation Schagen op 10 km. Voor Duitse toeristen minder aantrekkelijk (ver van grens, geen bekende naam). Marktanalyse Airbnb Dirkshorn: circa 20-30 objecten beschikbaar, nachtprijzen \u20ac80-140 voor vergelijkbare chalets. Concurrentie gemiddeld. Seizoenspatroon: vooral zomer (april-september), laagseizoen zwak. Jaar-rond verhuur mogelijk maar winterbezetting laag (max 20-30%). Omgeving geschikt voor natuurliefhebbers, rust, gezinnen met kinderen. Geen unique selling point qua locatie.",
      "red_flags": [
        "B-locatie, geen toptoeristische bestemming",
        "Laagseizoen bezetting zal laag zijn",
        "Beperkte internationale aantrekkelijkheid"
      ],
      "recommendations": [
        "Focus marketing op Nederlandse gezinnen",
        "Benadruk nabijheid strand Callantsoog (10 min)",
        "Cre\u00eber winterarrangementen om laagseizoen te vullen"
      ],
      "market_data": "Airbnb Dirkshorn: 20-30 vergelijkbare objecten, gemiddelde nachtprijs \u20ac100-120, reviews gemiddeld 15-30 per object (= 150-300 gasten/jaar). Booking.com: vergelijkbare pricing, lagere beschikbaarheid zichtbaar."
    },
    "property": {
      "score": 7.5,
      "reasoning": "Modern pand (2022) met goede specificaties: 65m\u00b2 woonoppervlak, 2 slaapkamers + 2 extra slaapkamers/woonruimtes op verdieping = effectief 4 slaapruimtes voor max 8 gasten. Groot perceel 115m\u00b2 met ruim terras (31m\u00b2) op oosten. Luxe keuken met kookeiland + tweede keuken boven is uniek voor deze prijsklasse. Moderne badkamer met inloopdouche. CV-ketel 2022, volledig ge\u00efsoleerd. Voordelen: nieuwbouwstaat = minimaal onderhoud eerste 5 jaar, volledige meubilering inclusief, professionele uitstraling. USP's: extra verdieping met tweede keuken (zeldzaam), groot terras, moderne afwerking, privacy door ligging aan plantsoen. Nadelen: geen hottub/sauna (belangrijk gemis voor premium pricing), geen expliciete vermelding huisdieren toegestaan (30% doelgroep mist), foto's zijn voldoende maar niet professioneel genoeg voor premium positionering. Doelgroep: gezinnen (4-8 personen), vriendengroepen. Max 8 gasten is goed voor omzet. Direct verhuurklaar, geen renovatie nodig.",
      "red_flags": [
        "Geen hottub/sauna (concurrentienadeel)",
        "Onduidelijk of huisdieren toegestaan"
      ],
      "recommendations": [
        "Investeer \u20ac3.000-5.000 in hottub (verhoogt nachtprijs \u20ac20-30)",
        "Maak huisdierbeleid expliciet (indien toegestaan)",
        "Upgrade naar professionele fotografie (\u20ac300-500)",
        "Voeg BBQ en loungeset toe aan terras (\u20ac800)"
      ],
      "usp_highlights": [
        "Extra verdieping met tweede keuken",
        "Nieuwbouw 2022 - minimaal onderhoud",
        "Groot terras 31m\u00b2",
        "Max 8 gasten = hoge capaciteit",
        "Privacy - ligging aan plantsoen"
      ]
    },
    "financial": {
      "score": 5.5,
      "reasoning": "INVESTERING: Vraagprijs \u20ac150k + 2% overdracht (\u20ac3k) + notaris (\u20ac2k) = \u20ac155k totaal. OMZET SCHATTING (conservatief): Hoogseizoen 12 weken (60% bezetting \u00d7 \u20ac140/nacht) = \u20ac7.056, Middenseizoen 24 weken (35% bezetting \u00d7 \u20ac100/nacht) = \u20ac8.400, Laagseizoen 16 weken (15% bezetting \u00d7 \u20ac80/nacht) = \u20ac1.344. Totaal bruto: \u20ac16.800/jaar. KOSTEN: Parkkosten \u20ac1.838, energie \u20ac1.800, gemeentelijk \u20ac400, platform fees 10% (\u20ac1.680), schoonmaak 35\u00d7 \u20ac60 (\u20ac2.100), wasgoed \u20ac600, onderhoud 8% (\u20ac1.344), accountant \u20ac1.000, verzekering \u20ac400 = \u20ac11.162/jaar. NETTO: \u20ac5.638/jaar. Cash-on-Cash Return: 3,6% - ONDERMAATS! Met hypotheek 70% (\u20ac105k \u00e0 5,5%): maandlast \u20ac675, netto cashflow -\u20ac206/maand. PROBLEEM: omzet te laag door B-locatie en ontbrekende USP's. Met hottub + betere marketing mogelijk \u20ac22k omzet (40% bezetting overall, \u20ac120 gemiddeld) \u2192 7,5% CoC. Break-even 8+ jaar zonder financiering. Scale-up: na 3 jaar waarschijnlijk max \u20ac165k verkoopprijs (+10%) = \u20ac10k winst na kosten. Onvoldoende voor opschaling.",
      "red_flags": [
        "CoC Return 3,6% veel te laag (target 10%+)",
        "Negatieve cashflow bij financiering",
        "Hoge parkkosten relatief (\u20ac1.838/jaar)",
        "Omzetpotentieel beperkt door locatie"
      ],
      "recommendations": [
        "Onderhandel minimaal naar \u20ac130k (scheelt \u20ac3k rendement)",
        "Investeer direct in hottub voor hogere nachtprijzen",
        "Verhoog bezetting door professionele marketing",
        "Overweeg volledig eigen inbreng (geen hypotheek)"
      ],
      "calculations": {
        "purchase_price": 150000,
        "total_investment": 155000,
        "estimated_annual_revenue": 16800,
        "estimated_annual_costs": 11162,
        "net_annual_income": 5638,
        "cash_on_cash_return": 3.6,
        "breakeven_years": 8.2
      }
    },
    "legal": {
      "score": 8.0,
      "reasoning": "VERHUURVRIJHEID: Geen expliciete vermelding van verhuurrestricties. '365 dagen per jaar recre\u00ebren' en 'interessante verhuurmogelijkheden' suggereren vrije verhuur. GEEN verplichte parkorganisatie (Landal/Roompot) genoemd. Parkkosten \u20ac1.838 inclusief BTW zijn beheerkosten, geen commissie. POSITIEF: volle eigendom (geen erfpacht), permanente bewoning niet toegestaan maar verhuur expliciet genoemd als mogelijkheid. Jaar-rond gebruik mogelijk. ONDUIDELIJK: parkreglement moet opgevraagd worden voor zekerheid over: (1) vrije platformkeuze, (2) geen goedkeuringsrecht parkeigenaar bij verhuur, (3) geen Recron beperkingen, (4) huisdierenbeleid. Bouwjaar 2022 = geen energielabel vereist nog. Kadaster volle eigendom bevestigd. FISCAAL: Box 1 indien professionele verhuur (>50% verhuur), Box 3 bij recreatief gebruik. BTW verrekenen mogelijk bij zakelijk verhuur. Toeristenbelasting gemeente Schagen moet doorberekend worden aan gasten. Geen vermelde privilege clausule of overdrachtskosten buiten normaal. CHECK VEREIST: parkreglement opvragen voor 100% zekerheid verhuurvrijheid.",
      "red_flags": [
        "Parkreglement niet beschikbaar - verhuurvoorwaarden onduidelijk",
        "Huisdierenbeleid niet expliciet"
      ],
      "recommendations": [
        "Vraag volledig parkreglement op bij beheerder",
        "Verifieer geen Recron restricties bij notaris",
        "Check huisdierenbeleid expliciet",
        "Bevestig vrije platformkeuze schriftelijk"
      ],
      "rental_freedom": "Waarschijnlijk vrije verhuur mogelijk (365 dagen genoemd), maar parkreglement moet dit bevestigen. Geen verplichte parkorganisatie zichtbaar."
    }
  },
  "overall_assessment": "Moderne recreatiewoning (2022) in goede staat op Park De Horn, Dirkshorn. Sterke punten: nieuwbouw, extra verdieping met tweede keuken, groot terras, max 8 gasten, verhuurvrijheid waarschijnlijk. Zwakke punten: B-locatie met beperkt toeristische aantrekkelijkheid, geen premium USP's (hottub ontbreekt), KRITISCH LAGE RENDEMENT van 3,6% CoC - ver onder target 10%+. Bij vraagprijs \u20ac150k en conservatieve bezetting is dit object NIET rendabel voor investering. Alleen interessant indien onderhandeling naar \u20ac130k mogelijk en direct investering in hottub (\u20ac4k) voor totaal \u20ac134k investering. Dan mogelijk 6-7% rendement met goede marketing. Scale-up potentieel beperkt: verwachte waardestijging \u20ac10-15k over 3 jaar onvoldoende voor opschaling naar duurder object. Voor zelfverhuur geschikt maar financieel onvoldoende aantrekkelijk.",
  "top_strengths": [
    "Nieuwbouw 2022 - minimaal onderhoud eerste 5 jaar, direct verhuurklaar",
    "Extra verdieping met tweede keuken uniek voor deze prijsklasse, max 8 gasten = hogere omzet potentieel",
    "Jaar-rond verhuur mogelijk (365 dagen), waarschijnlijk vrije platformkeuze, geen verplichte parkorganisatie"
  ],
  "top_concerns": [
    "KRITISCH: Cash-on-Cash Return 3,6% veel te laag - target minimum 10%+ voor BNB investering",
    "B-locatie Dirkshorn heeft beperkte toeristische aantrekkelijkheid, laagseizoen bezetting <20% verwacht",
    "Geen hottub/sauna - belangrijkste USP ontbreekt voor premium pricing (\u20ac20-30/nacht verschil)"
  ],
  "investment_recommendation": "AFWIJZEN bij vraagprijs \u20ac150k - rendement 3,6% onacceptabel laag. OVERWEGEN alleen indien: (1) onderhandeling naar \u20ac130k lukt, (2) bereid om \u20ac4k te investeren in hottub, (3) professionele verhuurstrategie met marketing budget \u20ac2k/jaar. Dan mogelijk 6-7% rendement haalbaar. Voor serieuze BNB investeerders met 10%+ rendement target is dit object niet geschikt.",
  "metadata": {
    "processing_time_seconds": 78.14,
    "llm_model": "claude",
    "apify_dataset_id": "Yb4fTMJ9wQsuyZf3L"
  }
}